{
  "id": "la-rioja-2023-05",
  "nombre": "Elecciones autonómicas de La Rioja del 28 de mayo de 2023",
  "tipo": "autonomicas",
  "fecha": "2023-05-28",
  "territorio": "la-rioja",
  "camara": "Parlamento de La Rioja",
  "umbralPorcentaje": 0.02,
  "denominador": {
    "tipo": "votos-a-candidaturas",
    "valor": 165559
  },
  "totalCandidaturasOficiales": 10,
  "fuente": {
    "titulo": "Resultados definitivos de las elecciones autonómicas de La Rioja",
    "url": "https://www.juntaelectoralcentral.es/cs/jec/documentos/Escrutinio%20General.pdf",
    "consultado": "2026-07-09"
  },
  "fuentesAdicionales": [
    {
      "titulo": "Proclamación e identidad de candidaturas de La Rioja",
      "url": "https://www.juntaelectoralcentral.es/cs/Satellite?c=JECInfoGeneral_C&childpagename=JEC%2FJEC_Layout&cid=1408441868692&d=Touch&packedargs=d%3DTouch&pagename=jec%2Fwrapper%2FJEC_Wrapper",
      "consultado": "2026-07-09"
    }
  ],
  "nota": "El porcentaje usa como denominador 165.559 votos a candidaturas en toda la comunidad. Una relación con un componente identifica la candidatura, pero no transfiere sus posiciones al perfil de la coalición. Naturaleza de la convocatoria en el inventario: ordinaria.",
  "candidaturas": [
    {
      "id": "rio-2023-pp",
      "nombre": "PARTIDO POPULAR",
      "votos": 76205,
      "porcentaje": 46.028908,
      "territorios": [
        "la-rioja"
      ],
      "motivoInclusion": "umbral",
      "perfilRelaciones": [
        {
          "perfilId": "pp",
          "relacion": "misma-organizacion"
        }
      ],
      "nota": "Naturaleza inventariada: partido. Vigencia comprobada: posterior-verificada. Tratamiento previsto: perfil-reutilizable."
    },
    {
      "id": "rio-2023-psoe",
      "nombre": "PARTIDO SOCIALISTA OBRERO ESPAÑOL",
      "votos": 53562,
      "porcentaje": 32.352213,
      "territorios": [
        "la-rioja"
      ],
      "motivoInclusion": "umbral",
      "perfilRelaciones": [
        {
          "perfilId": "psoe",
          "relacion": "misma-organizacion"
        }
      ],
      "nota": "Naturaleza inventariada: partido. Vigencia comprobada: posterior-verificada. Tratamiento previsto: perfil-reutilizable."
    },
    {
      "id": "rio-2023-vox",
      "nombre": "VOX",
      "votos": 12773,
      "porcentaje": 7.715074,
      "territorios": [
        "la-rioja"
      ],
      "motivoInclusion": "umbral",
      "perfilRelaciones": [
        {
          "perfilId": "vox",
          "relacion": "misma-organizacion"
        }
      ],
      "nota": "Naturaleza inventariada: partido. Vigencia comprobada: posterior-verificada. Tratamiento previsto: perfil-reutilizable."
    },
    {
      "id": "rio-2023-podemos-iu",
      "nombre": "PODEMOS-IZQUIERDA UNIDA",
      "votos": 8543,
      "porcentaje": 5.160094,
      "territorios": [
        "la-rioja"
      ],
      "motivoInclusion": "umbral",
      "perfilRelaciones": [
        {
          "perfilId": "podemos",
          "relacion": "componente",
          "nota": "Podemos figura como componente de esta candidatura fechada; sus posiciones no se atribuyen automáticamente a la coalición."
        }
      ],
      "nota": "Naturaleza inventariada: coalicion-electoral. Vigencia comprobada: matrices-verificadas. Tratamiento previsto: perfil-especifico."
    },
    {
      "id": "rio-2023-pr-ev",
      "nombre": "PARTIDO RIOJANO+ESPAÑA VACIADA",
      "votos": 6016,
      "porcentaje": 3.63375,
      "territorios": [
        "la-rioja"
      ],
      "motivoInclusion": "umbral",
      "perfilRelaciones": [],
      "nota": "Naturaleza inventariada: coalicion-electoral. Vigencia comprobada: matrices-verificadas. Tratamiento previsto: perfil-especifico."
    },
    {
      "id": "rio-2023-por-la-rioja",
      "nombre": "POR LA RIOJA",
      "votos": 4349,
      "porcentaje": 2.626858,
      "territorios": [
        "la-rioja"
      ],
      "motivoInclusion": "umbral",
      "perfilRelaciones": [],
      "nota": "Naturaleza inventariada: partido-o-candidatura. Vigencia comprobada: actividad-organizativa-verificada. Tratamiento previsto: perfil-especifico."
    },
    {
      "id": "rio-2023-cs",
      "nombre": "CIUDADANOS-PARTIDO DE LA CIUDADANÍA",
      "votos": 1473,
      "porcentaje": 0.889713,
      "territorios": [
        "la-rioja"
      ],
      "motivoInclusion": "umbral",
      "perfilRelaciones": [
        {
          "perfilId": "ciudadanos",
          "relacion": "misma-organizacion"
        }
      ],
      "nota": "Naturaleza inventariada: partido. Vigencia comprobada: posterior-verificada. Tratamiento previsto: perfil-reutilizable."
    },
    {
      "id": "rio-2023-pacma",
      "nombre": "PARTIDO ANIMALISTA CON EL MEDIO AMBIENTE",
      "votos": 1065,
      "porcentaje": 0.643275,
      "territorios": [
        "la-rioja"
      ],
      "motivoInclusion": "umbral",
      "perfilRelaciones": [
        {
          "perfilId": "pacma",
          "relacion": "misma-organizacion"
        }
      ],
      "nota": "Naturaleza inventariada: partido. Vigencia comprobada: posterior-verificada. Tratamiento previsto: perfil-reutilizable."
    },
    {
      "id": "rio-2023-vinea",
      "nombre": "VINEA La Rioja",
      "votos": 954,
      "porcentaje": 0.57623,
      "territorios": [
        "la-rioja"
      ],
      "motivoInclusion": "umbral",
      "perfilRelaciones": [],
      "nota": "Naturaleza inventariada: partido-o-candidatura. Vigencia comprobada: reordenacion-2026. Tratamiento previsto: inventario-sin-datos."
    },
    {
      "id": "rio-2023-eb",
      "nombre": "ESCAÑOS EN BLANCO PARA DEJAR ESCAÑOS VACÍOS",
      "votos": 619,
      "porcentaje": 0.373885,
      "territorios": [
        "la-rioja"
      ],
      "motivoInclusion": "umbral",
      "perfilRelaciones": [
        {
          "perfilId": "escanos-en-blanco",
          "relacion": "misma-organizacion",
          "nota": "Perfil sin posiciones codificadas (sin-datos razonado): partido de programa único cuyo punto programático no tiene ítem en el banco; se lista sin participar en el matching."
        }
      ],
      "nota": "Naturaleza inventariada: partido. Vigencia comprobada: posterior-verificada. Tratamiento previsto: perfil-reutilizable."
    }
  ]
}
