{
  "id": "cantabria-2023-05",
  "nombre": "Elecciones autonómicas de Cantabria del 28 de mayo de 2023",
  "tipo": "autonomicas",
  "fecha": "2023-05-28",
  "territorio": "cantabria",
  "camara": "Parlamento de Cantabria",
  "umbralPorcentaje": 0.02,
  "denominador": {
    "tipo": "votos-a-candidaturas",
    "valor": 318919
  },
  "totalCandidaturasOficiales": 12,
  "fuente": {
    "titulo": "Resultados definitivos de las elecciones autonómicas de Cantabria",
    "url": "https://www.juntaelectoralcentral.es/cs/jec/documentos/Cantabria%20resultados%202023.pdf",
    "consultado": "2026-07-09"
  },
  "nota": "El porcentaje usa como denominador 318.919 votos a candidaturas en toda la comunidad. Una relación con un componente identifica la candidatura, pero no transfiere sus posiciones al perfil de la coalición. Naturaleza de la convocatoria en el inventario: ordinaria.",
  "candidaturas": [
    {
      "id": "cnt-2023-partido-popular-de-cantabria",
      "nombre": "PARTIDO POPULAR DE CANTABRIA",
      "votos": 116198,
      "porcentaje": 36.434957,
      "territorios": [
        "cantabria"
      ],
      "motivoInclusion": "umbral",
      "perfilRelaciones": [
        {
          "perfilId": "pp",
          "relacion": "organizacion-territorial",
          "nota": "La candidatura corresponde a la organización territorial del perfil estatal; comparte identidad orgánica, no una matriz autonómica copiada."
        }
      ],
      "nota": "Naturaleza inventariada: organizacion-territorial. Vigencia comprobada: representacion-2023-2027. Tratamiento previsto: perfil-reutilizable."
    },
    {
      "id": "cnt-2023-partido-regionalista-de-cantabria",
      "nombre": "PARTIDO REGIONALISTA DE CANTABRIA",
      "votos": 67523,
      "porcentaje": 21.172461,
      "territorios": [
        "cantabria"
      ],
      "motivoInclusion": "umbral",
      "perfilRelaciones": [],
      "nota": "Naturaleza inventariada: partido-territorial. Vigencia comprobada: representacion-2023-2027. Tratamiento previsto: perfil-especifico."
    },
    {
      "id": "cnt-2023-partido-socialista-de-cantabria-psoe",
      "nombre": "PARTIDO SOCIALISTA DE CANTABRIA-PSOE",
      "votos": 66917,
      "porcentaje": 20.982444,
      "territorios": [
        "cantabria"
      ],
      "motivoInclusion": "umbral",
      "perfilRelaciones": [
        {
          "perfilId": "psoe",
          "relacion": "organizacion-territorial",
          "nota": "La candidatura corresponde a la organización territorial del perfil estatal; comparte identidad orgánica, no una matriz autonómica copiada."
        }
      ],
      "nota": "Naturaleza inventariada: federacion-territorial. Vigencia comprobada: representacion-2023-2027. Tratamiento previsto: perfil-reutilizable."
    },
    {
      "id": "cnt-2023-vox",
      "nombre": "VOX",
      "votos": 35982,
      "porcentaje": 11.282489,
      "territorios": [
        "cantabria"
      ],
      "motivoInclusion": "umbral",
      "perfilRelaciones": [
        {
          "perfilId": "vox",
          "relacion": "misma-organizacion"
        }
      ],
      "nota": "Naturaleza inventariada: partido. Vigencia comprobada: representacion-2023-2027. Tratamiento previsto: perfil-reutilizable."
    },
    {
      "id": "cnt-2023-podemos-izquierda-unida",
      "nombre": "PODEMOS-IZQUIERDA UNIDA",
      "votos": 13395,
      "porcentaje": 4.200126,
      "territorios": [
        "cantabria"
      ],
      "motivoInclusion": "umbral",
      "perfilRelaciones": [
        {
          "perfilId": "podemos",
          "relacion": "componente",
          "nota": "Podemos figura como componente de esta candidatura fechada; sus posiciones no se atribuyen automáticamente a la coalición."
        },
        {
          "perfilId": "iu",
          "relacion": "componente",
          "nota": "Izquierda Unida de Cantabria integra la coalición «Podemos-Izquierda Unida» (nº 2 de la lista, Carmen Martín, IU); confirmado por Podemos Cantabria e Izquierda Unida de Cantabria. Sus posiciones no se atribuyen automáticamente a la coalición."
        }
      ],
      "nota": "Naturaleza inventariada: coalicion-electoral. Vigencia comprobada: matrices-verificadas. Tratamiento previsto: perfil-especifico."
    },
    {
      "id": "cnt-2023-ciudadanos-partido-de-la-ciudadania",
      "nombre": "CIUDADANOS-PARTIDO DE LA CIUDADANIA",
      "votos": 7527,
      "porcentaje": 2.36016,
      "territorios": [
        "cantabria"
      ],
      "motivoInclusion": "umbral",
      "perfilRelaciones": [
        {
          "perfilId": "ciudadanos",
          "relacion": "misma-organizacion"
        }
      ],
      "nota": "Naturaleza inventariada: partido. Vigencia comprobada: posterior-verificada. Tratamiento previsto: perfil-reutilizable."
    },
    {
      "id": "cnt-2023-cantabristas",
      "nombre": "CANTABRISTAS",
      "votos": 5522,
      "porcentaje": 1.731474,
      "territorios": [
        "cantabria"
      ],
      "motivoInclusion": "umbral",
      "perfilRelaciones": [],
      "nota": "Naturaleza inventariada: partido-o-candidatura. Vigencia comprobada: no-comprobada. Tratamiento previsto: perfil-especifico."
    },
    {
      "id": "cnt-2023-partido-animalista-con-el-medio-ambiente",
      "nombre": "PARTIDO ANIMALISTA CON EL MEDIO AMBIENTE",
      "votos": 1837,
      "porcentaje": 0.576008,
      "territorios": [
        "cantabria"
      ],
      "motivoInclusion": "umbral",
      "perfilRelaciones": [
        {
          "perfilId": "pacma",
          "relacion": "misma-organizacion"
        }
      ],
      "nota": "Naturaleza inventariada: partido. Vigencia comprobada: posterior-verificada. Tratamiento previsto: perfil-reutilizable."
    },
    {
      "id": "cnt-2023-verdes-equo",
      "nombre": "VERDES EQUO",
      "votos": 1548,
      "porcentaje": 0.48539,
      "territorios": [
        "cantabria"
      ],
      "motivoInclusion": "umbral",
      "perfilRelaciones": [
        {
          "perfilId": "verdes-equo",
          "relacion": "misma-organizacion"
        }
      ],
      "nota": "Naturaleza inventariada: partido-o-candidatura. Vigencia comprobada: matrices-verificadas. Tratamiento previsto: perfil-especifico."
    },
    {
      "id": "cnt-2023-ola-cantabria",
      "nombre": "OLA CANTABRIA",
      "votos": 1125,
      "porcentaje": 0.352754,
      "territorios": [
        "cantabria"
      ],
      "motivoInclusion": "umbral",
      "perfilRelaciones": [],
      "nota": "Naturaleza inventariada: partido-o-candidatura. Vigencia comprobada: no-comprobada. Tratamiento previsto: inventario-sin-datos."
    },
    {
      "id": "cnt-2023-partido-comunista-de-los-trabajadores-de-espana",
      "nombre": "PARTIDO COMUNISTA DE LOS TRABAJADORES DE ESPAÑA",
      "votos": 757,
      "porcentaje": 0.237364,
      "territorios": [
        "cantabria"
      ],
      "motivoInclusion": "umbral",
      "perfilRelaciones": [
        {
          "perfilId": "pcte",
          "relacion": "misma-organizacion"
        }
      ],
      "nota": "Naturaleza inventariada: partido. Vigencia comprobada: posterior-verificada. Tratamiento previsto: perfil-reutilizable."
    },
    {
      "id": "cnt-2023-cantabria-distinta",
      "nombre": "CANTABRIA DISTINTA",
      "votos": 588,
      "porcentaje": 0.184373,
      "territorios": [
        "cantabria"
      ],
      "motivoInclusion": "umbral",
      "perfilRelaciones": [],
      "nota": "Naturaleza inventariada: partido-o-candidatura. Vigencia comprobada: no-comprobada. Tratamiento previsto: inventario-sin-datos."
    }
  ]
}
