{
  "id": "catalunya-2024-05",
  "nombre": "Elecciones autonómicas de Catalunya del 12 de mayo de 2024",
  "tipo": "autonomicas",
  "fecha": "2024-05-12",
  "territorio": "catalunya",
  "camara": "Parlament de Catalunya",
  "umbralPorcentaje": 0.02,
  "denominador": {
    "tipo": "votos-a-candidaturas",
    "valor": 3120503
  },
  "totalCandidaturasOficiales": 18,
  "fuente": {
    "titulo": "Resultados definitivos de las elecciones autonómicas de Catalunya",
    "url": "https://gencat.cat/eleccions/resultatsparlament2024/descarregues/dossier_ca_def.pdf",
    "consultado": "2026-07-10"
  },
  "fuentesAdicionales": [
    {
      "titulo": "Proclamación e identidad de candidaturas de Catalunya",
      "url": "https://gencat.cat/eleccions/parlament2024/es/formacions-politiques/candidatures/candidatures-proclamades/index.html",
      "consultado": "2026-07-10"
    }
  ],
  "nota": "El porcentaje usa como denominador 3.120.503 votos a candidaturas en toda la comunidad. Una relación con un componente identifica la candidatura, pero no transfiere sus posiciones al perfil de la coalición. Naturaleza de la convocatoria en el inventario: anticipada.",
  "candidaturas": [
    {
      "id": "cat-2024-psc",
      "nombre": "PSC",
      "votos": 882589,
      "porcentaje": 28.283549,
      "escanos": 42,
      "territorios": [
        "catalunya"
      ],
      "motivoInclusion": "umbral",
      "perfilRelaciones": [
        {
          "perfilId": "psoe",
          "relacion": "organizacion-territorial",
          "nota": "La candidatura corresponde a la organización territorial del perfil estatal; comparte identidad orgánica, no una matriz autonómica copiada."
        }
      ],
      "nota": "Naturaleza inventariada: federacion-territorial. Vigencia comprobada: representacion-2024. Tratamiento previsto: perfil-reutilizable."
    },
    {
      "id": "cat-2024-junts",
      "nombre": "CAT-JUNTS+",
      "votos": 681470,
      "porcentaje": 21.838466,
      "escanos": 35,
      "territorios": [
        "catalunya"
      ],
      "motivoInclusion": "umbral",
      "perfilRelaciones": [
        {
          "perfilId": "junts",
          "relacion": "coalicion"
        }
      ],
      "nota": "Naturaleza inventariada: coalicion-electoral. Vigencia comprobada: matrices-verificadas. Tratamiento previsto: perfil-reutilizable."
    },
    {
      "id": "cat-2024-erc",
      "nombre": "ERC",
      "votos": 431128,
      "porcentaje": 13.815978,
      "escanos": 20,
      "territorios": [
        "catalunya"
      ],
      "motivoInclusion": "umbral",
      "perfilRelaciones": [
        {
          "perfilId": "erc",
          "relacion": "misma-organizacion"
        }
      ],
      "nota": "Naturaleza inventariada: partido. Vigencia comprobada: representacion-2024. Tratamiento previsto: perfil-reutilizable."
    },
    {
      "id": "cat-2024-pp",
      "nombre": "PP",
      "votos": 347170,
      "porcentaje": 11.12545,
      "escanos": 15,
      "territorios": [
        "catalunya"
      ],
      "motivoInclusion": "umbral",
      "perfilRelaciones": [
        {
          "perfilId": "pp",
          "relacion": "misma-organizacion"
        }
      ],
      "nota": "Naturaleza inventariada: partido. Vigencia comprobada: representacion-2024. Tratamiento previsto: perfil-reutilizable."
    },
    {
      "id": "cat-2024-vox",
      "nombre": "VOX",
      "votos": 251096,
      "porcentaje": 8.046651,
      "escanos": 11,
      "territorios": [
        "catalunya"
      ],
      "motivoInclusion": "umbral",
      "perfilRelaciones": [
        {
          "perfilId": "vox",
          "relacion": "misma-organizacion"
        }
      ],
      "nota": "Naturaleza inventariada: partido. Vigencia comprobada: representacion-2024. Tratamiento previsto: perfil-reutilizable."
    },
    {
      "id": "cat-2024-comuns-sumar",
      "nombre": "COMUNS SUMAR",
      "votos": 184297,
      "porcentaje": 5.906003,
      "escanos": 6,
      "territorios": [
        "catalunya"
      ],
      "motivoInclusion": "umbral",
      "perfilRelaciones": [
        {
          "perfilId": "movimiento-sumar",
          "relacion": "componente",
          "nota": "Movimiento Sumar figura como componente de esta candidatura fechada; sus posiciones no se atribuyen automáticamente a la coalición."
        }
      ],
      "nota": "Naturaleza inventariada: coalicion-electoral. Vigencia comprobada: matrices-verificadas. Tratamiento previsto: perfil-especifico."
    },
    {
      "id": "cat-2024-cup-dt",
      "nombre": "CUP - DT",
      "votos": 129059,
      "porcentaje": 4.13584,
      "escanos": 4,
      "territorios": [
        "catalunya"
      ],
      "motivoInclusion": "umbral",
      "perfilRelaciones": [
        {
          "perfilId": "cup",
          "relacion": "coalicion"
        }
      ],
      "nota": "Naturaleza inventariada: coalicion-electoral. Vigencia comprobada: matriz-verificada. Tratamiento previsto: perfil-reutilizable."
    },
    {
      "id": "cat-2024-alianca",
      "nombre": "ALIANÇA.CAT",
      "votos": 119149,
      "porcentaje": 3.818263,
      "escanos": 2,
      "territorios": [
        "catalunya"
      ],
      "motivoInclusion": "umbral",
      "perfilRelaciones": [],
      "nota": "Naturaleza inventariada: partido. Vigencia comprobada: representacion-2024. Tratamiento previsto: perfil-especifico."
    },
    {
      "id": "cat-2024-pacma",
      "nombre": "PACMA",
      "votos": 34493,
      "porcentaje": 1.105367,
      "escanos": 0,
      "territorios": [
        "catalunya"
      ],
      "motivoInclusion": "umbral",
      "perfilRelaciones": [
        {
          "perfilId": "pacma",
          "relacion": "misma-organizacion"
        }
      ],
      "nota": "Naturaleza inventariada: partido. Vigencia comprobada: posterior-verificada. Tratamiento previsto: perfil-reutilizable."
    },
    {
      "id": "cat-2024-cs",
      "nombre": "Cs",
      "votos": 22947,
      "porcentaje": 0.735362,
      "escanos": 0,
      "territorios": [
        "catalunya"
      ],
      "motivoInclusion": "umbral",
      "perfilRelaciones": [
        {
          "perfilId": "ciudadanos",
          "relacion": "misma-organizacion"
        }
      ],
      "nota": "Naturaleza inventariada: partido. Vigencia comprobada: posterior-verificada. Tratamiento previsto: perfil-reutilizable."
    },
    {
      "id": "cat-2024-alhora",
      "nombre": "ALHORA",
      "votos": 14104,
      "porcentaje": 0.451978,
      "escanos": 0,
      "territorios": [
        "catalunya"
      ],
      "motivoInclusion": "umbral",
      "perfilRelaciones": [],
      "nota": "Naturaleza inventariada: partido. Vigencia comprobada: posterior-verificada. Tratamiento previsto: perfil-especifico."
    },
    {
      "id": "cat-2024-fo",
      "nombre": "FO",
      "votos": 10118,
      "porcentaje": 0.324243,
      "escanos": 0,
      "territorios": [
        "catalunya"
      ],
      "motivoInclusion": "umbral",
      "perfilRelaciones": [],
      "nota": "Naturaleza inventariada: partido. Vigencia comprobada: posterior-verificada. Tratamiento previsto: perfil-especifico."
    },
    {
      "id": "cat-2024-pctc",
      "nombre": "PCTC",
      "votos": 4212,
      "porcentaje": 0.134978,
      "escanos": 0,
      "territorios": [
        "catalunya"
      ],
      "motivoInclusion": "umbral",
      "perfilRelaciones": [
        {
          "perfilId": "pcte",
          "relacion": "organizacion-territorial",
          "nota": "La candidatura corresponde a la organización territorial del perfil estatal; comparte identidad orgánica, no una matriz autonómica copiada."
        }
      ],
      "nota": "Naturaleza inventariada: organizacion-territorial. Vigencia comprobada: posterior-verificada. Tratamiento previsto: perfil-reutilizable."
    },
    {
      "id": "cat-2024-recortes-cero",
      "nombre": "RECORTES CERO",
      "votos": 3487,
      "porcentaje": 0.111745,
      "escanos": 0,
      "territorios": [
        "catalunya"
      ],
      "motivoInclusion": "umbral",
      "perfilRelaciones": [
        {
          "perfilId": "recortes-cero",
          "relacion": "misma-organizacion"
        }
      ],
      "nota": "Naturaleza inventariada: partido. Vigencia comprobada: actividad-electoral-posterior-no-verificada. Tratamiento previsto: perfil-reutilizable."
    },
    {
      "id": "cat-2024-pumj",
      "nombre": "PUM+J",
      "votos": 2760,
      "porcentaje": 0.088447,
      "escanos": 0,
      "territorios": [
        "catalunya"
      ],
      "motivoInclusion": "umbral",
      "perfilRelaciones": [],
      "nota": "Naturaleza inventariada: partido. Vigencia comprobada: posterior-verificada. Tratamiento previsto: perfil-especifico."
    },
    {
      "id": "cat-2024-izqp",
      "nombre": "IZQP - UNIDOS - DEf",
      "votos": 1892,
      "porcentaje": 0.060631,
      "escanos": 0,
      "territorios": [
        "catalunya"
      ],
      "circunscripciones": [
        "Barcelona",
        "Tarragona"
      ],
      "motivoInclusion": "umbral",
      "perfilRelaciones": [],
      "nota": "Naturaleza inventariada: coalicion-electoral. Vigencia comprobada: continuidad-conjunta-no-verificada. Tratamiento previsto: inventario-sin-datos."
    }
  ]
}
