{
  "id": "murcia-2023-05",
  "nombre": "Elecciones autonómicas de Región de Murcia del 28 de mayo de 2023",
  "tipo": "autonomicas",
  "fecha": "2023-05-28",
  "territorio": "murcia",
  "camara": "Asamblea Regional de Murcia",
  "umbralPorcentaje": 0.02,
  "denominador": {
    "tipo": "votos-a-candidaturas",
    "valor": 676554
  },
  "totalCandidaturasOficiales": 15,
  "fuente": {
    "titulo": "Resultados definitivos de las elecciones autonómicas de Región de Murcia",
    "url": "https://econet.carm.es/web/crem/inicio/-/crem/sicrem/PU2077/sec51.html",
    "consultado": "2026-07-09"
  },
  "nota": "El porcentaje usa como denominador 676.554 votos a candidaturas en toda la comunidad. Una relación con un componente identifica la candidatura, pero no transfiere sus posiciones al perfil de la coalición. Naturaleza de la convocatoria en el inventario: ordinaria.",
  "candidaturas": [
    {
      "id": "mur-2023-pp",
      "nombre": "Partido Popular",
      "votos": 293051,
      "porcentaje": 43.315242,
      "territorios": [
        "murcia"
      ],
      "motivoInclusion": "umbral",
      "perfilRelaciones": [
        {
          "perfilId": "pp",
          "relacion": "misma-organizacion"
        }
      ],
      "nota": "Naturaleza inventariada: partido. Vigencia comprobada: posterior-verificada. Tratamiento previsto: perfil-reutilizable."
    },
    {
      "id": "mur-2023-psoe",
      "nombre": "Partido Socialista Obrero Español",
      "votos": 175505,
      "porcentaje": 25.941019,
      "territorios": [
        "murcia"
      ],
      "motivoInclusion": "umbral",
      "perfilRelaciones": [
        {
          "perfilId": "psoe",
          "relacion": "misma-organizacion"
        }
      ],
      "nota": "Naturaleza inventariada: partido. Vigencia comprobada: posterior-verificada. Tratamiento previsto: perfil-reutilizable."
    },
    {
      "id": "mur-2023-vox",
      "nombre": "VOX",
      "votos": 121321,
      "porcentaje": 17.932198,
      "territorios": [
        "murcia"
      ],
      "motivoInclusion": "umbral",
      "perfilRelaciones": [
        {
          "perfilId": "vox",
          "relacion": "misma-organizacion"
        }
      ],
      "nota": "Naturaleza inventariada: partido. Vigencia comprobada: posterior-verificada. Tratamiento previsto: perfil-reutilizable."
    },
    {
      "id": "mur-2023-podemos-iu-av",
      "nombre": "Podemos-Izquierda Unida Verdes-Alianza Verde",
      "votos": 32173,
      "porcentaje": 4.755422,
      "territorios": [
        "murcia"
      ],
      "motivoInclusion": "umbral",
      "perfilRelaciones": [
        {
          "perfilId": "podemos",
          "relacion": "componente",
          "nota": "Podemos figura como componente de esta candidatura fechada; sus posiciones no se atribuyen automáticamente a la coalición."
        },
        {
          "perfilId": "alianza-verde",
          "relacion": "componente",
          "nota": "Alianza Verde figura como componente de esta candidatura fechada; sus posiciones no se atribuyen automáticamente a la coalición."
        },
        {
          "perfilId": "iu",
          "relacion": "componente",
          "nota": "Izquierda Unida (IU-Verdes de la Región de Murcia) integra la coalición «Podemos-Izquierda Unida-Alianza Verde» junto a Podemos y Alianza Verde; confirmado por Podemos Región de Murcia y prensa regional (Murcia Plaza). Sus posiciones no se atribuyen automáticamente a la coalición."
        }
      ],
      "nota": "Naturaleza inventariada: coalicion-electoral. Vigencia comprobada: matrices-verificadas. Tratamiento previsto: perfil-especifico."
    },
    {
      "id": "mur-2023-mc",
      "nombre": "MC Regional",
      "votos": 20206,
      "porcentaje": 2.986606,
      "territorios": [
        "murcia"
      ],
      "motivoInclusion": "umbral",
      "perfilRelaciones": [],
      "nota": "Naturaleza inventariada: partido-o-candidatura. Vigencia comprobada: actividad-local-verificada. Tratamiento previsto: perfil-especifico."
    },
    {
      "id": "mur-2023-cs",
      "nombre": "Ciudadanos-Partido de la Ciudadanía",
      "votos": 10480,
      "porcentaje": 1.549026,
      "territorios": [
        "murcia"
      ],
      "motivoInclusion": "umbral",
      "perfilRelaciones": [
        {
          "perfilId": "ciudadanos",
          "relacion": "misma-organizacion"
        }
      ],
      "nota": "Naturaleza inventariada: partido. Vigencia comprobada: posterior-verificada. Tratamiento previsto: perfil-reutilizable."
    },
    {
      "id": "mur-2023-mas-region-vq",
      "nombre": "Mas Region-Verdes Equo",
      "votos": 8919,
      "porcentaje": 1.318298,
      "territorios": [
        "murcia"
      ],
      "motivoInclusion": "umbral",
      "perfilRelaciones": [
        {
          "perfilId": "verdes-equo",
          "relacion": "componente",
          "nota": "Verdes Equo figura como componente de esta candidatura fechada; sus posiciones no se atribuyen automáticamente a la coalición."
        }
      ],
      "nota": "Naturaleza inventariada: coalicion-electoral. Vigencia comprobada: matrices-verificadas. Tratamiento previsto: perfil-especifico."
    },
    {
      "id": "mur-2023-pacma",
      "nombre": "Partido Animalista Con el Medio Ambiente",
      "votos": 5957,
      "porcentaje": 0.880491,
      "territorios": [
        "murcia"
      ],
      "motivoInclusion": "umbral",
      "perfilRelaciones": [
        {
          "perfilId": "pacma",
          "relacion": "misma-organizacion"
        }
      ],
      "nota": "Naturaleza inventariada: partido. Vigencia comprobada: posterior-verificada. Tratamiento previsto: perfil-reutilizable."
    },
    {
      "id": "mur-2023-por-mi-region",
      "nombre": "Por mi Region",
      "votos": 2449,
      "porcentaje": 0.361981,
      "territorios": [
        "murcia"
      ],
      "motivoInclusion": "umbral",
      "perfilRelaciones": [],
      "nota": "Naturaleza inventariada: partido-o-candidatura. Vigencia comprobada: actividad-local-verificada. Tratamiento previsto: perfil-especifico."
    },
    {
      "id": "mur-2023-3e",
      "nombre": "Tercera Edad en Acción",
      "votos": 1479,
      "porcentaje": 0.218608,
      "territorios": [
        "murcia"
      ],
      "motivoInclusion": "umbral",
      "perfilRelaciones": [],
      "nota": "Naturaleza inventariada: partido-o-candidatura. Vigencia comprobada: actividad-organizativa-verificada. Tratamiento previsto: perfil-especifico."
    },
    {
      "id": "mur-2023-murcia-libre",
      "nombre": "Murcia Libre",
      "votos": 1442,
      "porcentaje": 0.213139,
      "territorios": [
        "murcia"
      ],
      "motivoInclusion": "umbral",
      "perfilRelaciones": [],
      "nota": "Naturaleza inventariada: partido-o-candidatura. Vigencia comprobada: no-comprobada. Tratamiento previsto: inventario-sin-datos."
    },
    {
      "id": "mur-2023-valores",
      "nombre": "Valores",
      "votos": 1336,
      "porcentaje": 0.197471,
      "territorios": [
        "murcia"
      ],
      "motivoInclusion": "umbral",
      "perfilRelaciones": [],
      "nota": "Naturaleza inventariada: partido-o-candidatura. Vigencia comprobada: no-comprobada. Tratamiento previsto: inventario-sin-datos."
    },
    {
      "id": "mur-2023-pcpe",
      "nombre": "Partido Comunista de los Pueblos de España",
      "votos": 1152,
      "porcentaje": 0.170275,
      "territorios": [
        "murcia"
      ],
      "motivoInclusion": "umbral",
      "perfilRelaciones": [
        {
          "perfilId": "pcpe",
          "relacion": "misma-organizacion"
        }
      ],
      "nota": "Naturaleza inventariada: partido. Vigencia comprobada: posterior-verificada. Tratamiento previsto: perfil-reutilizable."
    },
    {
      "id": "mur-2023-fe",
      "nombre": "Falange Española de las J.O.N.S",
      "votos": 554,
      "porcentaje": 0.081886,
      "territorios": [
        "murcia"
      ],
      "motivoInclusion": "umbral",
      "perfilRelaciones": [
        {
          "perfilId": "fe-jons",
          "relacion": "misma-organizacion"
        }
      ],
      "nota": "Naturaleza inventariada: partido. Vigencia comprobada: posterior-verificada. Tratamiento previsto: perfil-reutilizable."
    },
    {
      "id": "mur-2023-pcan",
      "nombre": "Partido Cantonal de Cartagena",
      "votos": 530,
      "porcentaje": 0.078338,
      "territorios": [
        "murcia"
      ],
      "motivoInclusion": "umbral",
      "perfilRelaciones": [],
      "nota": "Naturaleza inventariada: partido. Vigencia comprobada: actividad-organizativa-verificada. Tratamiento previsto: perfil-especifico."
    }
  ]
}
